serialnumber,provide_contain,provide_shelter,provide_goods,no,countycode,name,district,areacode,village,address,floor,service_village,contact_person,contact_cellphone,suit_for_weak,person,floorspacebuildingothers,floorspacebuildingfactory,suit_for_flood,suit_for_mudflow,suit_for_eqrthquake,suit_for_tsunami,standing_shelter,longitude,latitude
368,是,是,否,SF251-0025,65000,淡水國中,淡水區,65000100,文化里,新北市淡水區真理街10號,誠正樓地下室(為學生桌球課程場地)、中正堂1樓(為學生雨天室內活動場地)、二校區操場、籃球場、中庭廣場、二校區操場、籃球場、中庭廣場,文化里、油車里、新民里、新生里,王心郁,932210527.0,是,1608.0,2812,7240.0,是,是,是,是,否,121.436724,25.174719
369,是,是,否,SF251-0026,65000,新市國小,淡水區,65000100,北投里,新北市淡水區中山北路2段200號,多功能教室-A棟2樓、幼兒園-B棟一樓、操場,北投里、埤島里、崁頂里、新春里,洪壽嶸,921281079.0,是,1220.0,880,8000.0,是,是,是,否,否,121.528371,25.087222
370,否,是,否,SF251-0027,65000,水源里活動中心,淡水區,65000100,水源里,新北市淡水區北新路2段15號,活動中心1樓,水源里,郭哲銘,912905356.0,否,72.0,288,0.0,是,是,是,是,否,121.444278,25.177624
371,否,是,否,SF251-0028,65000,樹興里活動中心,淡水區,65000100,樹興里,新北市淡水區樹林口14之2號,活動中心1樓,樹興里,陳健宏,918131071.0,否,59.0,236,0.0,是,否,否,是,否,121.479026,25.168091
372,否,是,否,SF251-0029,65000,興音寺,淡水區,65000100,樹興里,新北市淡水區興福寮1之6號,1-3樓,樹興里,陳健宏,918131071.0,否,50.0,200,0.0,是,否,否,是,否,121.48835,25.163997
373,否,是,否,SF251-0030,65000,真聖宮,淡水區,65000100,樹興里,新北市淡水區興福寮6之1號,1樓,樹興里,陳健宏,918131071.0,否,50.0,200,0.0,是,否,否,是,否,121.49217,25.165542
374,是,是,否,SF251-0032,65000,公八防災公園,淡水區,65000100,崁頂里,新北市淡水區中山北路二段381巷2號,公園綠地,中和里、屯山里、賢孝里、興仁里、蕃薯里、義山里、忠山里、崁頂里、埤島里、水碓里、新興里、北投里、水源里、忠寮里、樹興里、坪頂里、福德里、竹圍里、民生里、八勢里、竿蓁里、鄧公里、中興里、長庚里、清文里、草東里、協元里、永吉里、民安里、新生里、文化里、油車里、沙崙里、新義里、新春里、新民里、正德里、北新里、民權里、幸福里、學府里、大庄里,吳書嫺,919337212.0,否,1087.0,0,8700.0,否,否,是,否,否,121.4427,25.187149
375,是,否,否,SF251-0033,65000,前山營區 ,淡水區,65000100,福德里,新北市淡水區自立路17 號,1樓,福德里、民權里,吳書嫺,919337212.0,否,60.0,200,0.0,是,是,是,是,否,121.462494,25.129598
376,是,否,否,SF251-0034,65000,后山營區,淡水區,65000100,福德里,新北市淡水區自強路419號,1樓,福德里、民權里,吳書嫺,919337212.0,否,60.0,200,0.0,是,是,是,是,否,121.46567,25.134157
377,是,是,否,SF251-0035,65000,真理大學,淡水區,65000100,文化里,新北市淡水區真理街32號,交誼廳,文化里、新生里、協元里、新民里、油車里,廖忠山,932118440.0,是,118.0,473,0.0,是,是,是,是,否,121.434601,25.175558
378,是,是,否,SF251-0036,65000,淡江大學,淡水區,65000100,中興里,新北市淡水區英專路151號,學生活動中心,中興里、幸福里、鄧公里、學府里、北新里、正德里,陳玥合,978035334.0,是,211.0,842,0.0,是,是,是,是,否,121.447099,25.173829
379,是,是,否,SF251-0037,65000,臺北基督學院,淡水區,65000100,福德里,新北市淡水區自強路51號,體育館1樓,福德里、民權里、竹圍里,王建智,955127991.0,是,156.0,625,0.0,是,是,是,是,否,121.461543,25.131283
380,是,是,否,SF251-0038,65000,聖約翰科技大學,淡水區,65000100,賢孝里,新北市淡水區淡金路四段499號,百齡堂,賢孝里、興仁里、屯山里、蕃薯里、中和里,郭淳汯,918182634.0,是,1000.0,4000,0.0,是,是,是,是,否,121.451673,25.226984
381,是,是,否,SF251-0039,65000,樹興里辦公處,淡水區,65000100,樹興里,新北市淡水區樹林口42之3號,1樓,樹興里,陳健宏,918131071.0,是,44.0,177,0.0,是,是,是,是,否,121.470438,25.168484
382,是,是,否,SF251-0040,65000,義山市民活動中心,淡水區,65000100,義山里,新北市淡水區奎柔山路1號、3號,地下1樓,義山里、忠山里、忠寮里、蕃薯里、興仁里,吳書嫺,919337212.0,是,162.0,482,338.52,是,是,是,是,否,121.474412,25.206675
383,否,是,否,SF251-0041,65000,淡江高中,淡水區,65000100,文化里,新北市淡水區真理街26號,體育館,文化里、協元里、新生里、新民里,邱文賓,928566351.0,是,2890.0,4500,14122.0,是,是,是,是,否,121.43583,25.17506
384,是,是,否,SF248-0001,65000,更新市民活動中心,五股區,65000150,更寮里,新北市五股區更寮里更洲路47號,1樓,興珍里、更寮里、集福里,李典倫,986079181.0,是,65.0,260,0.0,是,是,是,是,是,121.457261,25.079366
385,是,是,否,SF248-0003,65000,成功市民活動中心,五股區,65000150,成功里,新北市五股區成功里西雲路163號,2樓,成州里、成功里、成德里、六福里、成泰里,李典倫,986079181.0,是,100.0,400,0.0,是,是,是,是,是,121.44234,25.098822
386,是,是,否,SF248-0004,65000,成州市民活動中心,五股區,65000150,成州里,新北市五股區成州里西雲路267號,1樓,集福里、成州里、成功里、成德里、六福里、集賢里、成泰里,李典倫,986079181.0,是,75.0,300,0.0,是,是,是,是,是,121.449355,25.098099
387,是,是,否,SF248-0005,65000,新北市五股區立體停車場,五股區,65000150,五股里,新北市五股區五股里工商路3號,1樓,興珍里、更寮里、五股里、五福里、德音里,里幹事徐豐郁,916240757.0,是,550.0,2200,0.0,是,是,否,是,是,121.439278,25.08296
388,是,是,否,SF248-0006,65000,成州國民小學,五股區,65000150,成州里,新北市五股區成州里成泰路三段493號,禮堂1樓、操場及風雨操場,集福里、觀音里、成州里、成功里、五龍里、陸一里、成德里、六福里、集賢里,事務組長楊擎政,922298743.0,是,370.25,337,2294.0,是,是,是,是,否(備援),121.450517,25.099771
389,是,是,否,SF248-0007,65000,更寮國民小學,五股區,65000150,興珍里,新北市五股區興珍里四維路2號,樂群館2樓、操場,興珍里、更寮里,總務主任李聖文,910069063.0,是,288.0,425,1456.0,是,是,否,是,否(備援),121.467318,25.07092
390,是,是,否,SF248-0008,65000,五股國民小學,五股區,65000150,五股里,新北市五股區五股里成泰路二段49號,多功能教學大樓、1樓大會議室、2樓教室、3 樓體育館、操場及球場,五龍里、五股里、五福里、陸一里、民義里、福德里,事務組長呂雅萍,910371229.0,是,856.0,2453,1947.0,是,是,否,是,否(備援),121.437361,25.082653
391,是,是,否,SF248-0009,65000,德音國民小學,五股區,65000150,水碓里,新北市五股區水碓里明德路2號,維心樓113活動教室、維心樓114樂齡中心、風雨操場,德音里、貿商里、德泰里、民義里、水碓里、福德里,總務主任程麗華,921459263.0,是,118.0,120,704.0,是,是,否,是,否(備援),121.43455,25.071372
392,是,是,否,SF248-0010,65000,五股國民中學,五股區,65000150,五股里,新北市五股區五股里成泰路二段49巷15號,忠孝樓1樓飛鏢教室、813教室、風雨操場,五股里、五福里、貿商里、德泰里、水碓里,總務主任劉怡君,988658044.0,是,214.25,93,1535.0,是,否,否,是,否(備援),121.435723,25.083273
393,是,是,否,SF248-0011,65000,憲訓中心,五股區,65000150,德音里,新北市五股區德音里成泰路一段175號,生活區A棟3樓,德音里、貿商里、德泰里、水碓里,作訓科士官長簡世坪,917789687.0,否,686.0,2745,0.0,是,是,否,是,否(備援),121.434894,25.075847
394,是,是,是,SF248-0012,65000,公民會館,五股區,65000150,成泰里,新北市五股區成泰里御史路1巷59號,1樓,觀音里、五龍里、陸一里、民義里、成泰里、福德里,李典倫,986079181.0,是,182.0,731.23,0.0,是,是,是,是,是,121.440248,25.090328
395,是,是,否,SF248-0013,65000,觀音市民活動中心,五股區,65000150,觀音里,新北市五股區觀音里凌雲路三段17之2號,1樓,觀音里、集賢里,李典倫,986079181.0,是,149.0,599.41,0.0,是,是,是,是,是,121.429996,25.107677
396,是,是,否,SF248-0014,65000,防災體健公園,五股區,65000150,成德里,新北市五股區成德里成泰路三段與成州八路交叉,1樓,五股里、水碓里、成功里、成泰里、五福里、集賢里、集福里、成德里、德音里、五龍里、民義里、福德里、貿商里、里興珍、觀音里、陸一里、六福里、更寮里、德泰里、成州里,李典倫,986079181.0,是,1330.0,0,10642.0,是,是,是,是,是,,
397,是,是,否,SF249-0001,65000,龍米市民活動中心,八里區,65000230,龍源里,新北市八里區龍米路1段223號,1樓、3樓,龍源里、米倉里,陳盈臻,908627920.0,是,125.0,400,200.0,是,是,是,否,是,121.449138,25.138261
398,是,是,是,SF249-0003,65000,大崁老人活動中心,八里區,65000230,大崁里,新北市八里區大崁里中山路1段21號,1樓、2樓、3樓,大崁里、埤頭里、頂罟里,陳盈臻,908627920.0,是,100.0,400,,是,是,是,否,是,121.42386,25.158981
399,是,是,否,SF249-0004,65000,大埤頂市民活動中心,八里區,65000230,大崁里,新北市八里區中山路1段95號,1樓,大崁里、埤頭里、頂罟里,陳盈臻,908627920.0,是,70.0,280,,是,是,是,否,是,121.44421,25.169489
400,是,是,否,SF249-0005,65000,文化活動中心,八里區,65000230,舊城里,新北市八里區中山路2段251號1樓,1樓,舊城里、訊塘里、荖阡里,陳盈臻,908627920.0,是,100.0,400,,是,是,是,否,是,121.397711,25.077472
401,是,是,是,SF249-0006,65000,長坑市民活動中心,八里區,65000230,長坑里,新北市八里區中華路三段190號,1樓、2樓、3樓,下罟里、長坑里,陳盈臻,908627920.0,是,100.0,400,,是,是,是,否,是,121.389672,25.128335
402,是,是,否,SF249-0008,65000,八里國小,八里區,65000230,舊城里,新北市八里區中山路二段338號,朝陽樓B1、觀海樓B1、至善樓B1、運動場,舊城里、訊塘里,林炳宏總務主任,919589707.0,是,1151.0,1665,5886.0,是,是,是,否,否,121.403031,25.149515
403,是,是,否,SF249-0009,65000,大崁國小,八里區,65000230,大崁里,新北市八里區忠八街2號,B棟4樓綜合教室、B棟5樓風雨操場、操場,大崁里,呂立琪總務主任,935757748.0,是,956.0,942,5768.0,是,是,是,是,否,121.419406,25.160305
404,是,是,否,SF249-0010,65000,米倉國小,八里區,65000230,米倉里,新北市八里區龍米路2段129巷1號,朝陽樓2樓(大禮堂)、朝陽樓地下1樓(樂活館)、操場,米倉里,蔡佳玲總務主任,921083060.0,否,688.0,580,4350.0,是,是,是,是,否,121.458458,25.114582
405,是,是,否,SF249-0011,65000,長坑國小,八里區,65000230,長坑里,新北市八里區中華路三段236號,活動中心1樓、視聽教室2樓、籃球場,長坑里、下罟里,鍾榮進總務主任,918337371.0,否,242.0,220,1500.0,是,是,是,是,否,121.389328,25.126274
406,是,是,否,SF249-0012,65000,八里國中,八里區,65000230,荖阡里,新北市八里區荖阡坑路15號,活動中心、B1地下室空間、操場,荖阡里、長坑里、下罟里,陳俊傑總務主任,932080495.0,是,499.0,861.5,2275.0,是,是,是,是,否,121.400251,25.1404
407,是,是,否,SF249-0013,65000,聖心女中,八里區,65000230,龍源里,新北市八里區龍米路一段263號,聖心樓地下一樓風雨操場、操場司令台、行政大樓一樓小禮堂、操場,龍源里、米倉里,陳瑞璋總務主任,932000039.0,否,940.0,660,6200.0,是,是,是,是,否,121.449423,25.137398
408,是,是,否,SF249-0014,65000,商港公園,八里區,65000230,訊塘里,新北市八里區商港一路和商港八路交叉口,公園,訊塘里、舊城里、荖阡里,陳盈臻,908627920.0,是,1324.0,,5299.0,否,是,是,否,否,121.399935,25.150816
409,是,是,否,SF249-0015,65000,八里區公所文康活動中心 ,八里區,65000230,頂罟里,新北市八里區八里大道22號,1樓,埤頭里、頂罟里,陳盈臻,908627920.0,是,70.0,280,,是,是,是,否,是,121.406459,25.153317
410,是,是,否,SF249-0016,65000,聖心國小,八里區,65000230,龍源里,新北市八里區龍米路一段261號,活動中心1F、音樂教室2F、操場,龍源里,翁志弘總務主任,936706841.0,是,204.0,348,936.0,是,是,是,是,否,121.450368,25.134217
411,是,是,是,SF243-0001,65000,泰山區公所,泰山區,65000160,同榮里,新北市泰山區明志路1段322號,5樓展演廳,同榮里、同興里、福泰里、福興里,陳俊佑,980216198.0,是,53.0,214,0.0,是,是,是,是,是,121.424919,25.043431
412,是,是,否,SF243-0002,65000,泰山國中,泰山區,65000160,山腳里,新北市泰山區泰林路二段498號,學生活動中心、體育室,大科里、山腳里、黎明里,陳美蓮,,否,1052.0,1895.3,4661.0,是,是,否,是,否,121.42452,25.064008
413,是,是,否,SF243-0003,65000,黎明市民活動中心,泰山區,65000160,黎明里,新北市泰山區黎明路23號,活動中心1樓,黎明里、大科里,施呈林,980464588.0,否,21.0,86,0.0,是,是,否,是,否,121.420974,25.062742
414,是,是,否,SF243-0004,65000,泰山國小,泰山區,65000160,山腳里,新北市泰山區泰林路二段255號,學生活動中心,大科里、山腳里、黎明里、楓樹里,薛政宏,916913590.0,否,1305.0,1220,8000.0,是,是, 是,是,否,121.431285,25.062342
415,是,是,是,SF243-0005,65000,泰山體育館,泰山區,65000160,同榮里,新北市泰山區公園路54號,館內1及3樓,同榮里、同興里、義學里、義仁里、全興里,蔣雅淇,920235693.0,是,1280.0,2000,6240.0,是,是, 是,是,否,121.426599,25.055339
416,是,是,否,SF243-0006,65000,同榮國小,泰山區,65000160,同榮里,新北市泰山區公園路30號,教學大樓前棟及後棟地下一樓地上五樓,同榮里、義學里、義仁里,田聖山,936954268.0,否,1957.0,13584,3662.0,是,是, 是,是,否,121.429121,25.054367
417,是,是,否,SF243-0007,65000,義學國小,泰山區,65000160,義仁里,新北市泰山區民生路30號,人文樓與科技樓連接處下方的地下禮堂、人文樓與科技樓三樓連接廣場、人文樓與科技樓四樓連接廣場,明志里、義學里、義仁里、同榮里,張子韻,987875136.0,否,773.0,800,4585.0,是,是, 是,是,否,121.430493,25.05241
418,是,是,否,SF243-0008,65000,明志國小,泰山區,65000160,泰友里,新北市泰山區新生路2號,體育館-綜合大樓3F,明志里、新明里、泰友里、貴和里,張雅婷,912705418.0,否,1024.0,1346,5510.0,是,是, 是,是,否,121.427453,25.045245
419,是,是,否,SF243-0009,65000,義學國中,泰山區,65000160,義仁里,新北市泰山區民生路33號,專科大樓二樓-藝文教室一、專科大樓三樓-藝文教室五、專科大樓三樓-體健教室,義學里、義仁里、全興里,陳信全,978126508.0,否,573.0,240,4110.0,是,是, 是,是,否,121.430621,25.052138
420,是,是,否,SF243-0010,65000,泰山高中,泰山區,65000160,同榮里,新北市泰山區辭修路7號,四維堂禮堂,同榮里、同興里、福興里、全興里,劉宗鑫,963376996.0,否,570.0,1050,2471.0,是,是, 是,是,否,121.427988,25.058151
421,是,是,否,SF243-0011,65000,明志科技大學,泰山區,65000160,貴子里,新北市泰山區工專路84號,體育館3樓,貴子里、貴賢里、貴和里,邱明誌,921858959.0,否,1803.0,1230,11972.0,是,否, 是,是,是,121.419338,25.042631
422,是,是,否,SF243-0012,65000,黎明技術學院,泰山區,65000160,黎明里,新北市泰山區泰林路三段22號,體育館,大科里、黎明里、山腳里,陳佳記,953166619.0,否,1081.0,2292,4064.0,是,是, 是,是,否,121.419616,25.065895
423,是,是,否,SF243-0013,65000,明志市民活動中心,泰山區,65000160,明志里,新北市泰山區明志路二段426號,活動中心1、4、5樓,明志里、新明里、泰友里,陳春祈,937029602.0,否,20.0,80,0.0,是,否, 是,是,否,121.424712,25.043812
424,是,是,否,SF243-0014,65000,貴和市民活動中心,泰山區,65000160,貴和里,新北市泰山區明志路三段365號,活動中心1樓,貴和里、貴賢里、貴子里,余碧玉,916385922.0,否,76.0,304,0.0,是,是, 是,是,是,121.421725,25.034884
425,是,是,否,SF243-0015,65000,楓樹福泰市民活動中心,泰山區,65000160,楓樹里,新北市泰山區楓江路26巷26號,活動中心1、2樓及地下室,楓樹里、福泰里、山腳里,鄭美玲,920263993.0,否,201.0,806,0.0,是,是, 是,是,是,121.434895,25.061662
426,是,是,否,SF243-0016,65000,義仁市民活動中心,泰山區,65000160,義仁里,新北市泰山區明志路二段177號,活動中心1、2樓,義學里、義仁里、泰友里、明志里,許火炎,935128797.0,否,55.0,220,0.0,是,是, 是,是,否,121.427674,25.049867
427,是,是,否,SF243-0017,65000,山腳市民活動中心,泰山區,65000160,山腳里,新北市泰山區福德街14號,活動中心1樓、2樓,山腳里、福泰里、楓樹里,王國超,953318318.0,否,62.0,248,0.0,是,是, 是,是,是,121.432334,25.062661
428,是,是,是,SF244-0001,65000,林口區公所,林口區,65000170,西林里,新北市林口區仁愛路一段378號,區公所4樓,林口里、西林里,李宜聰,986677087.0,是,120.0,480,0.0,是,是,否,是,是,121.388524,25.076741
429,是,是,否,SF244-0002,65000,林口國民小學,林口區,65000170,菁湖里,新北市林口區林口路76號,永愛樓3樓、竹林樓-4樓,菁湖里、中湖里,陳筠樺,938829598.0,是,302.0,1208,0.0,是,是,是,是,否,121.389893,25.080842
430,是,是,是,SF244-0003,65000,嘉寶國民小學,林口區,65000170,嘉寶里,新北市林口區嘉溪雅坑22號,教學1樓教室,嘉寶里、下福里,楊雅玉,923615672.0,否,109.0,436,0.0,是,否,是,是,是,121.339328,25.108345
431,是,是,是,SF244-0004,65000,興福國民小學,林口區,65000170,下福里,新北市林口區下福里20鄰10-1號,活動中心 2 樓,下福里、瑞平里,廖淑珍,935333771.0,是,236.0,943,0.0,是,是,是,是,是,121.295876,25.120417
432,是,是,是,SF244-0005,65000,瑞平國民小學,林口區,65000170,太平里,新北市林口區太平里後坑34之1,3樓禮堂,嘉寶里、下福里、瑞平里、太平里,陳姿蓉,923615672.0,是,68.0,270,0.0,是,是,是,否,是,121.349226,25.128313
433,是,是,否,SF244-0006,65000,醒吾高級中學,林口區,65000170,東林里,新北市林口區粉寮路一段75巷80號,誠品樓4樓,東林里,許哲瑋,,否,190.0,760,0.0,是,是,是,否,否,121.395821,25.079696
434,是,是,否,SF244-0007,65000,林口國民中學,林口區,65000170,湖南里,新北市林口區民治路25號,活動中心1、3樓教室,西林里、仁愛里,邱于真,937842163.0,否,415.0,1659,0.0,是,是,是,是,否,121.376896,25.076858
435,是,否,否,SF244-0008,65000,麗園國民小學,林口區,65000170,麗園里,新北市林口區忠孝路591號,活動中心2樓,麗園里、東勢里,鄭至真,988385195.0,否,320.0,1280,0.0,是,是,是,是,否,121.376195,25.068589
436,是,是,否,SF244-0009,65000,麗林國民小學,林口區,65000170,麗林里,新北市林口區公園路46號,活動中心1樓、、活動中心地下室,麗林里、仁愛里,張娟娟,983365395.0,是,484.0,1935,1653.0,是,是,是,是,否,121.367903,25.068715
437,是,是,是,SF244-0010,65000,南勢國民小學,林口區,65000170,南勢里,新北市林口區南勢街215號,人文樓、創新樓,南勢里,陳彥勳,935522336.0,是,341.0,1364.12,0.0,是,是,是,是,是,121.3589,25.075227
438,是,是,否,SF244-0011,65000,林口高中,林口區,65000170,東勢里,新北市林口區仁愛路二段173號,活動中心1樓、活動中心3樓,西林里,陳志煒,913177386.0,是,415.0,1659,0.0,是,是,是,是,否,121.381002,25.073639
439,是,否,否,SF244-0012,65000,崇林國民中學,林口區,65000170,麗園里,新北市林口區文化一路一段20號,地下室(桌球教室+跆拳道教室+舞蹈教室)+3樓活動中心,東勢里、麗園里、麗林里,張萬億,935522336.0,是,813.0,3250,0.0,是,是,否,是,否,121.370276,25.068112
440,是,否,否,SF244-0013,65000,頭湖國民小學,林口區,65000170,湖南里,新北市林口區民權路101號,語藝樓,湖南里、頂福里,鄭伊琳,912901510.0,否,100.0,400,0.0,是,是,是,是,否,121.372859,25.082737
441,是,是,否,SF244-0014,65000,佳林國民中學,林口區,65000170,中湖里,新北市林口區中山路268號,多功能教學資源中心,湖南里、中湖里、菁湖里,黃義勝,919353534.0,是,213.0,853,0.0,是,是,是,是,否,121.384227,25.08033
442,是,是,否,SF244-0015,65000,湖南市民活動中心,林口區,65000170,湖南里,新北市林口區民權路165號,1-2樓,湖南里、中湖里,張俊穎,937421339.0,是,139.0,556.93‬,0.0,是,是,是,是,否,121.374172,25.0844
443,是,是,否,SF244-0016,65000,麗林市民活動中心,林口區,65000170,麗林里,新北市林口區公園路59號,3樓,麗林里,張俊穎,937421339.0,是,276.0,1104.18,0.0,是,是,是,是,否,121.367623,25.068816
444,是,是,否,SF244-0017,65000,林口西林市民活動中心,林口區,65000170,林口里,新北市林口區中正路100號,3樓,林口里、東林里,張俊穎,937421339.0,否,65.0,259.47,0.0,是,是,是,是,否,121.393971,25.077322
445,是,是,否,SF244-0018,65000,湖北市民活動中心,林口區,65000170,湖北里,新北市林口區後湖17-6號,1-2樓,湖北里、太平里、嘉寶里、頂福里,張俊穎,937421339.0,否,125.0,499.23,0.0,是,是,是,是,否,121.384898,25.107509
446,是,是,否,SF244-0020,65000,師範大學林口校區,林口區,65000170,林口里,新北市林口區仁愛路一段2號,體育館1F、B1,林口里,鄭國輝,937890776.0,否,629.0,2517,0.0,是,,否,是,否,121.397844,25.067902
447,是,是,否,SF244-0021,65000,麗園市民活動中心,林口區,65000170,麗園里,新北市林口區忠孝路569巷17號,2樓,麗園里,張俊穎,937421339.0,否,75.0,300,0.0,是,是,是,是,否,121.373776,25.068979
448,是,是,否,SF244-0022,65000,東勢市民活動中心,林口區,65000170,東勢里,新北市林口區麗園一街35號,3樓,東勢里,張俊穎,937421339.0,是,268.0,1072.35,0.0,是,是,是,是,否,121.377252,25.068776
449,是,是,否,SF244-0023,65000,南勢市民活動中心,林口區,65000170,南勢里,新北市林口區南勢二街154號,1-2樓,南勢里,張俊穎,937421339.0,是,198.0,792.77,0.0,是,是,是,是,否,121.359019,25.073835
450,是,是,否,SF244-0024,65000,太平市民活動中心,林口區,65000170,太平里,新北市林口區汕頭32號,1樓,太平里、瑞平里,張俊穎,937421339.0,否,77.0,276.91,21.0,是,是,是,是,否,121.366376,25.135256
451,是,是,否,SF244-0025,65000,仁愛市民活動中心,林口區,65000170,仁愛里,新北市林口區文化一路一段137號,2樓,仁愛里、南勢里,張俊穎,937421339.0,是,195.0,779.63,0.0,是,是,是,是,否,121.37391,25.071967
452,是,是,否,SF244-0026,65000,新北特殊教育學校,林口區,65000170,湖南里,新北市林口區文化北路一段425號,活動中心、學生宿舍4樓、國中小中庭,南勢里、湖南里,黃維齡,939082318.0,是,1118.0,4471,0.0,是,是,是,是,否,121.365938,25.078446
453,是,是,否,SF244-0027,65000,林口防災公園,林口區,65000170,仁愛里,新北市林口區文化一路口跟仁愛路口交界處,公園內部,仁愛里,黎麗芳,910573387.0,否,1961.0,0,15692.0,是,是,是,是,是,121.375404,25.072826
454,是,是,否,SF244-0028,65000,下福市民活動中心,林口區,65000170,下福里,新北市林口區下福里11鄰下福139-13號,1樓,下福里,張俊穎,937421339.0,是,251.0,1006.73,0.0,是,是,是,是,否,121.295876,25.120417
455,是,是,否,SF244-0029,65000,新林國小,林口區,65000170,南勢里,新北市林口區三民路101號,1樓,南勢里,徐淳鈴,981000295.0,是,225.0,900,0.0,是,是,是,是,否,121.359475,25.069577
456,是,是,否,SF244-0030,65000,東湖國小-社福大樓,林口區,65000170,西林里,新北市林口區佳林路200號,社福大樓4樓,西林里,余雅筑,937421339.0,是,80.0,320,0.0,是,是,是,是,否,121.382006,25.075913
457,是,是,是,SF222-0001,65000,深坑區公所,深坑區,65000180,深坑里,新北市深坑區深坑街10號5樓,5樓禮堂,深坑、埔新、賴仲、土庫、昇高、阿柔、萬順、萬福8里,辛旻翰,970893663.0,是,75.0,400,0.0,是,是,是,是,是,121.615966,25.002523
458,是,是,否,SF222-0002,65000,深坑國中,深坑區,65000180,深坑里,新北市深坑區文化街41號,情境教室-弘藝樓2樓、國樂教室-弘藝樓3樓、風雨操場,深坑里、埔新里、昇高里、土庫里等,汪以竣,921235126.0,是,264.0,540,1041.0,是,是,是,是,否,121.618263,25.001741
459,是,是,否,SF222-0003,65000,深坑國小,深坑區,65000180,深坑里,新北市深坑區文化街45號,禮堂1樓及運動場,深坑里、埔新里、阿柔里等,吳玉瑩,928066192.0,是,632.0,364,4328.0,是,是,是,是,否,121.616875,25.001803
460,是,是,否,SF222-0004,65000,東南科技大學,深坑區,65000180,萬福里,新北市深坑區北深路3段152號,中山樓1樓(夢初體育館),深坑里、萬順里、萬福里等,吳正士,933221814.0,是,916.0,817,5699.0,是,是,是,是,否,121.621039,25.004469
461,是,是,否,SF222-0005,65000,深坑第二市民活動中心,深坑區,65000180,深坑里,新北市深坑區北深路2段166號,1樓,深坑里、埔新里、萬福里等,孟霆,986871725.0,是,103.0,213,200.0,是,是,是,是,否,121.640888,25.011227
